ILI,definition,lemma_names,sentiment_SWN,sentiment_lexicon,sentiment_sa
ENG30-00975452-n,Napad koji prodire u neprijateljsku tertoriju.,['prodiranje'],"(0.0, 0.0)",negative,Negativan
ENG30-14405931-n,iznenadni masovni strah i nespokojstvo zbog očekivanih događaja,['panika'],"(0.0, 0.0)",negative,Negativan
ENG30-02263346-v,šta kome poveriti,"['dati', 'davati', 'poveravati', 'poveriti', 'predati', 'predavati']","(0.0, 0.0)",positive,Neutralan
ENG30-06770275-n,iskaz (usmeni ili pisani) kojim se razmenjuju uzjamana obećanja,"['sporazum', 'dogovor']","(0.0, 0.0)",positive,Negativan
ENG30-07557165-n,Nešto što je posebno izabrano za jelo.,"['delikates', 'poslastica']","(0.0, 0.0)",positive,Neutralan
ENG30-00079470-v,"tretirati, ispraviti nedostatak","['ispraviti', 'ispravljati', 'korigovati']","(0.0, 0.0)",positive,Negativan
ENG30-13489037-n,U biologiji organski proces povećanja telesne mase; potpuno biloški tok događaja u kome se organizmi postepeno menjaju iz jednostavnijih u složenije oblike.,"['rast', 'ontogeneza']","(0.0, 0.0)",positive,Neutralan
ENG30-01193721-v,ispuniti do mere u kojoj ste zadovoljni,"['ispuniti', 'napuniti', 'napuniti se', 'popuniti', 'puniti se', 'zasititi se']","(0.0, 0.0)",positive,Negativan
ENG30-01301410-v,Onesposobiti kretanje nekom tako što se smesti unutar nekih granica.,"['zadržati', 'zatvoriti']","(0.0, 0.0)",negative,Neutralan
ENG30-02371718-a,"koji je sličan po veličini, obliku i relativnoj poziciji odgovarajućih delova",['simetričan'],"(0.0, 0.0)",positive,Neutralan
ENG30-01128655-n,čin savladavanja ili potčinjavanja nekoga,"['autoritet', 'dominacija', 'kontrola', 'moć', 'ovladavanje', 'prevlast', 'sila', 'vlast']","(0.0, 0.0)",positive,Negativan
ENG30-07164546-n,Nešto što se nudi (kao predlog ili zahtev).,['ponuda'],"(0.0, 0.0)",positive,Neutralan
ENG30-02737833-n,bilo kakav ekstremitet koji podseća na ruku,"['grana', 'grana (deo drveta)', 'grana drveta', 'grančica', 'noga', 'ogranak', 'pritoka', 'ruka', 'rukav', 'rukavac', 'ud']","(0.0, 0.0)",positive,Neutralan
ENG30-01755504-v,prikupiti i zapaliti materijal za,"['napraviti', 'praviti', 'spraviti']","(0.0, 0.0)",negative,Negativan
ENG30-02138911-a,biti jedini od svoje vrste,"['jedan', 'jedini', 'jedinstven', 'neponovljiv']","(0.0, 0.0)",positive,Negativan
ENG30-00273306-b,u ubilačkom ludilu,"['besomučno', 'ubilački']","(0.0, 0.0)",negative,Negativan
ENG30-00796976-v,odbiti s gnušanjem,"['odbaciti', 'odbacivati', 'odbijati', 'odbiti', 'prezirati', 'prezreti']","(0.0, 0.0)",negative,Negativan
ENG30-14446652-n,stanje napetosti i osećanja bolova,"['bolnost', 'iritacija', 'napetost', 'nelagodnost', 'neprijatnost', 'neudobnost', 'neugodnost']","(0.0, 0.0)",negative,Negativan
ENG30-02213690-v,odbiti da se nešto preda ili podeli,['zadržati'],"(0.0, 0.0)",negative,Negativan
ENG30-13367070-n,Nabavka nečega da bi bilo dostupno za buduće korišćenje.,"['zaliha', 'rezerva']","(0.0, 0.0)",positive,Neutralan
ENG30-07199565-n,Govorni čin koji nastavlja razgovor.,['odgovor'],"(0.0, 0.0)",negative,Neutralan
ENG30-09480809-n,deo Zemlje koji se može posebno razmatrati,['svet'],"(0.0, 0.0)",positive,Neutralan
ENG30-01256417-n,Čin vođenja.,"['vođenje', 'liderstvo']","(0.0, 0.0)",positive,Negativan
ENG30-01134238-v,opaliti ili se isprazniti,"['isprazniti', 'opaliti', 'opaljivati']","(0.0, 0.0)",negative,Negativan
ENG30-02520997-v,proveravati ili regulisati sprovođenjem paralelnog eksperimenta ili upoređivanjem sa drugim referentom (o naučnim eksperimentima),"['kontrolisati', 'nadzirati', 'potvrditi', 'potvrđivati', 'proveravati', 'proveriti', 'verifikovati']","(0.0, 0.0)",positive,Neutralan
ENG30-00770543-n,čin koji zanemaruje kakav raniji dogovor ili čije pravo,"['kršenje', 'napad', 'nepoštovanje', 'povreda', 'prekršaj', 'prestup']","(0.0, 0.0)",negative,Negativan
ENG30-01069980-n,uzdržavanje od hrane,['post'],"(0.0, 0.0)",negative,Neutralan
ENG30-00077419-n,Čin sticanja svojine ili nečeg drugog.,['sticanje'],"(0.0, 0.0)",positive,Negativan
ENG30-00179035-a,koga je vlast osnovala; koji je dobio odobrenje vlasti,"['prihvaćen', 'odobren']","(0.0, 0.0)",positive,Neutralan
ENG30-15221596-n,Dan kada se slavi neki svetac.,['svetac'],"(0.0, 0.0)",positive,Neutralan
ENG30-02552449-v,Povratiti u izvorno stanje.,"['rekonstruisati', 'obnoviti']","(0.0, 0.0)",positive,Neutralan
ENG30-07243837-n,"Obraćanje religiozne prirode, obično za vreme verske službe.",['propoved'],"(0.0, 0.0)",positive,Neutralan
ENG30-02377181-n,Nekastrirani mužjak konja.,['pastuv'],"(0.0, 0.0)",positive,Negativan
ENG30-00023773-n,Psihološko svojstvo koje pobuđuje neki organizam na akciju prema željenom cilju; razlog za akciju; ono što daje nameru i usmerava ponašanje.,"['motiv', 'pobuda']","(0.0, 0.0)",positive,Neutralan
ENG30-07227772-n,Obaveza da će se nešto dati ili da će se uzdržati od nečega.,['zavet'],"(0.0, 0.0)",positive,Negativan
ENG30-04931965-n,Način na koji se nešto konstruiše i raspored njegovih delova.,['struktura'],"(0.0, 0.0)",positive,Neutralan
ENG30-08387354-n,obrazovna i intelektualna elita,"['intelektualna elita', 'inteligencija']","(0.0, 0.0)",positive,Neutralan
ENG30-00295701-n,Čin odlaženja iz jednog mesta u drugo.,"['put', 'putovanje']","(0.0, 0.0)",positive,Neutralan
ENG30-02263346-v,šta kome poveriti,"['dati', 'davati', 'poveravati', 'poveriti', 'predati', 'predavati']","(0.0, 0.0)",positive,Neutralan
ENG30-07307754-n,Iznenadno ispuštanje energije.,['izbijanje'],"(0.0, 0.0)",negative,Negativan
ENG30-03219135-n,mala replika osobe; koristi se kao igračka,['lutka'],"(0.0, 0.0)",negative,Negativan
ENG30-14039534-n,Psihološka potreba za hranom; posledica uzdržavanja od hrane.,['glad'],"(0.0, 0.0)",negative,Neutralan
ENG30-00785962-v,sprovoditi istragu o nečemu,"['istražiti', 'islediti']","(0.0, 0.0)",positive,Neutralan
ENG30-07209089-n,(pravo) formalna primedba na tvrdnju suprotne strane,['prigovor'],"(0.0, 0.0)",negative,Negativan
ENG30-02116118-v,čija osećanja uzrujati,"['izazivati', 'izazvati', 'ložiti', 'nadahnuti', 'nagnati', 'nagoniti', 'nagovarati', 'nagovoriti', 'naložiti', 'napaliti', 'navesti', 'navoditi', 'paliti', 'podstaći', 'podstaknuti', 'podsticati', 'pokrenuti', 'pokretati', 'potaknuti', 'provocirati', 'stimulirati', 'stimulisati', 'uzbuditi', 'uzbuđivati', 'zagrejati']","(0.0, 0.0)",negative,Negativan
ENG30-01631072-v,"Ponovo uspostaviti na novoj, obiyno boljoj, osnovi; učiniti da nešto bude kao novo.",['obnoviti'],"(0.0, 0.0)",positive,Negativan
ENG30-00120784-a,biti ili imati nepoznat ili neimenovan izvor,"['neidentifikovan', 'neimenovan', 'neodređen', 'nepoznat', 'nespecifikovan', 'skriven']","(0.0, 0.0)",negative,Neutralan
ENG30-09917593-n,Mlada osoba bilo kog pola (između rođenja i puberteta).,['dete'],"(0.0, 0.0)",positive,Neutralan
ENG30-13597794-n,U pozicionom brojnom sistemu pozitivni celi broj koji je ekvivalentan jedinici na sledećem višem rednom mestu (matematika).,['osnova'],"(0.0, 0.0)",negative,Neutralan
ENG30-13831441-n,Pravac u kome pokazuje igla kompasa.,"['sever', 'magnetski sever']","(0.0, 0.0)",negative,Negativan
ENG30-06601327-n,"Ideja koja se podrazumeva, ili koja je izražena ili se podrazumeva.","['značenje', 'smisao']","(0.0, 0.0)",positive,Neutralan
ENG30-15042052-n,blato ili glina ili sitan kamen koje talože reka ili jezero,"['Alevrit', 'blato', 'mulj']","(0.0, 0.0)",negative,Neutralan
ENG30-01416539-v,udarati čekićem ili kao čekićem,"['kucati', 'ukucati', 'zakucati']","(0.0, 0.0)",negative,Negativan
ENG30-04866465-n,osobina neodlučnosti i nemanja čvrstog cilja,"['neodlučnost', 'nesigurnost', 'oklevanje']","(0.0, 0.0)",negative,Negativan
ENG30-00266806-n,Čin dovođenja stvari ponovo u red.,"['popravka', 'reparacija']","(0.0, 0.0)",positive,Negativan
ENG30-10780632-n,"Udara žena, čovekova partnerka u braku.","['udata žena', 'supruga', 'drugarica']","(0.0, 0.0)",positive,Negativan
ENG30-04181228-n,kaiš koji zadržava ili ograničava slobodu (naročito nešto što se koristi za vezivanje ili zadržavanje zatvorenika),"['lanci', 'veza']","(0.0, 0.0)",negative,Negativan
ENG30-05988282-n,nedostatak znanja ili obrazovanja,"['neobrazovanost', 'neukost', 'neznanje', 'sirovost']","(0.0, 0.0)",negative,Negativan
ENG30-10021892-n,osoba koja ima doktorat neke akademske institucije,"['doktor', 'dr']","(0.0, 0.0)",positive,Neutralan
ENG30-00194912-v,poseći šumu,"['ogoliti', 'opustiti', 'opustošiti']","(0.0, 0.0)",negative,Neutralan
ENG30-00362355-n,čin kojim se umanjuje jačina nekoga ili nečega,['slabljenje'],"(0.0, 0.0)",negative,Neutralan
ENG30-10560352-n,Predavač u školi ispod nivoa koledža.,"['nastavnik', 'profesor']","(0.0, 0.0)",positive,Neutralan
ENG30-05222790-n,u anatomiji struktura koja razdvaja oblasti u organizmu.,"['particija', 'pregrada']","(0.0, 0.0)",negative,Neutralan
ENG30-00790308-v,koristiti točkić za izbor broja telefona,"['birati', 'izabrati', 'okrenuti', 'okretati']","(0.0, 0.0)",positive,Neutralan
ENG30-13953608-n,položaj najvišeg autoriteta,"['komanda', 'kontrola', 'tron', 'vlast']","(0.0, 0.0)",positive,Negativan
ENG30-03661340-n,Pokretni gornji deo nekog kontejnera koji ga zatvara i otvara; može biti na šarkama ili ne.,"['poklopac', 'zaklopac']","(0.0, 0.0)",negative,Neutralan
ENG30-08521816-n,tačka jednako udaljena od krajeva linije ili završetaka lika,"['centar', 'središte', 'sredina']","(0.0, 0.0)",positive,Neutralan
ENG30-00202236-v,Namerno učiniti nešto pogrešnim ili netačnim.,['falsifikovati'],"(0.0, 0.0)",negative,Negativan
ENG30-02892767-n,donje rublje koje nose žene za podršku grudima,['grudnjak'],"(0.0, 0.0)",negative,Negativan
ENG30-01123148-a,"imati poželjne ili pozitivne kvalitete, posebno one koji su pogodni za određenu stvar","['častan', 'dobar', 'pouzdan']","(0.0, 0.0)",positive,Neutralan
ENG30-14433587-n,stanje kada je čovek uvažen; široko poznat ili eminentan,"['eminencija', 'istaknutost', 'prominentnost', 'reputacija', 'ugled', 'uvaženost']","(0.0, 0.0)",positive,Pozitivan
ENG30-02234781-a,ono što dovodi do toga da se nešto kliza,['klizav'],"(0.0, 0.0)",positive,Negativan
ENG30-01619014-v,"šta praviti ili dizajnirati, često na određeni način","['činiti', 'formirati', 'graditi', 'načiniti', 'napraviti', 'praviti', 'proizvesti', 'proizvoditi', 'sagraditi', 'stvoriti', 'tvoriti', 'učiniti']","(0.0, 0.0)",negative,Neutralan
ENG30-02116980-v,provocirati ili uzbuditi,"['delovati na', 'izazivati', 'izazvati', 'izvršiti uticaj', 'uplivisati', 'uticati', 'uzbuditi', 'uzbuđivati', 'vršiti uticaj']","(0.0, 0.0)",positive,Negativan
ENG30-07977870-n,Zbirka književnih dokumenata ili zapisa koji se drže radi čitanja.,['biblioteka'],"(0.0, 0.0)",positive,Neutralan
ENG30-05823054-n,Nešto (kao činjenica ili okolnost) što pokazuje da je čin bio razuman ili potreban.,['opravdanje'],"(0.0, 0.0)",positive,Neutralan
ENG30-13973059-n,Stanje bezvlašća i nereda (obično kao rezultat pada vlade).,"['anarhija', 'bezakonje']","(0.0, 0.0)",negative,Negativan
ENG30-00759500-n,nadmoćno osećanje straha i zebnje,"['panika', 'užas', 'strava']","(0.0, 0.0)",negative,Negativan
ENG30-11503644-n,Bilo koa mehanička sila koja teži da uspori ili zaustavi kretanje.,['otpor'],"(0.0, 0.0)",negative,Negativan
ENG30-01425892-v,maziti ili nežno milovati,['maziti'],"(0.0, 0.0)",positive,Negativan
ENG30-00233335-v,Staviti u granice domet ili pristup.,"['ograničiti', 'limitirati']","(0.0, 0.0)",negative,Neutralan
ENG30-14435445-n,status velike uvaženosti zbog istaknute superiornosti,"['eminencija', 'istaknutost', 'odlika', 'prominentnost', 'reputacija', 'ugled', 'uvaženost']","(0.0, 0.0)",positive,Negativan
ENG30-01126846-v,postaviti blokade,['blokirati'],"(0.0, 0.0)",negative,Negativan
ENG30-07999699-n,apstraktan zbir brojeva i simbola,['skup'],"(0.0, 0.0)",negative,Neutralan
ENG30-13129165-n,tanka ili izdužena struktura koja drži biljku ili gljivu ili deo ili organ biljke,"['peteljka', 'stabljika']","(0.0, 0.0)",negative,Neutralan
ENG30-13930725-n,"Odnos obeležen jakom zavisnošću od drugih,  posebno vezanost putem libida, najčešće za roditelje.","['anaklitizam', 'bliskost']","(0.0, 0.0)",positive,Neutralan
ENG30-13464820-n,"Proces u kome nešto postepeno prelazi u drugo stanje, posebno u naprednije ili zrelije stanje.","['razvoj', 'razvitak', 'evolucija']","(0.0, 0.0)",positive,Neutralan
ENG30-00065639-v,Pretrpeti (o povredama i bolestima).,"['dobiti', 'zadobiti', 'pretrpeti']","(0.0, 0.0)",positive,Negativan
ENG30-00809201-a,u kontroli,"['nadležan', 'odgovoran', 'zadužen']","(0.0, 0.0)",positive,Negativan
ENG30-14475661-n,stanje nesreće ili nevolje,"['nedaća', 'nesreća', 'nevolja', 'tegoba', 'teškoća']","(0.0, 0.0)",negative,Negativan
ENG30-08151229-n,Pristaše jednog posebnog sistema verskih verovanja i običaja.,['kult'],"(0.0, 0.0)",negative,Neutralan
ENG30-02529945-a,niti toplo niti veoma hladno; koji pruža olakšnaje od toplote,"['prohladan', 'svež']","(0.0, 0.0)",negative,Neutralan
ENG30-01041349-n,čin prinošenja hleba i vina prilikom pričesti,"['pričest', 'pričešće', 'religiozni prinos']","(0.0, 0.0)",positive,Neutralan
ENG30-00097504-n,Čin obavljanja nečega uspešno koristeći znanje.,"['izvođenje', 'izvršenje']","(0.0, 0.0)",negative,Neutralan
ENG30-08110373-n,Klasifikaciona grupa čiji članovi mogu da se razmnožavaju između sebe (biologija).,['vrsta'],"(0.0, 0.0)",positive,Neutralan
ENG30-14841267-n,smesa gasova - posebno -kisoenika koja je neophodna za disanje,['vazduh'],"(0.0, 0.0)",negative,Negativan
ENG30-01848718-v,udaljavati se s kog mesta u drugom pravcu,"['napuštati', 'napustiti', 'odjedriti', 'odjezditi', 'odlaziti', 'odstupati', 'odstupiti', 'ostaviti', 'ostavljati', 'otići', 'otputovati', 'udaljavati se', 'udaljiti se']","(0.0, 0.0)",negative,Neutralan
ENG30-12165384-n,Vrežasta biljka iz roda Cucumis; gaji se od davnina zbog valjkastog zelenog ploda.,"['krastavac', 'kornišon', 'Cucumis sativus']","(0.0, 0.0)",negative,Neutralan
ENG30-04599396-n,Proizvod napravljen ili postignut naporom ili aktivnošću neke osobe ili stvari.,"['delo', 'rad']","(0.0, 0.0)",positive,Neutralan
ENG30-01150938-n,čin pristajanja (kao što je pristupanje čijim zahtevima),"['pristajanje', 'pristanak']","(0.0, 0.0)",positive,Negativan
ENG30-01637982-v,"Učiniti neko otkriće, učiniti novi pronalazak.","['pronaći', 'izumeti', 'otkriti']","(0.0, 0.0)",positive,Negativan
ENG30-08663156-n,Krajnji deo nečega; posebno nešto zašiljeno.,"['vrh', 'vršak']","(0.0, 0.0)",positive,Neutralan
ENG30-01909978-v,uzrokovati da se nešto prevrne,"['prevrnuti', 'izvrnuti', 'iskrenuti']","(0.0, 0.0)",negative,Negativan
ENG30-08643933-n,sigurno mesto,"['utočište', 'pribežište']","(0.0, 0.0)",positive,Neutralan
ENG30-01232684-n,Čin odlaska na viđenje sa nekom osobom ili na neko mesto nakratko.,['poseta'],"(0.0, 0.0)",negative,Neutralan
ENG30-07748416-n,bilo koja vrsta mandarine koja raste u Sjedinjenim državama ili južnoj Africi,['mandarina'],"(0.0, 0.0)",positive,Neutralan
ENG30-02235842-v,prenositi ili otkrivati informacije,"['dati', 'davati', 'obelodaniti', 'obelodanjivati', 'obznaniti', 'obznanjivati', 'odati', 'odavati', 'otkriti', 'otkrivati', 'predati', 'predavati', 'preneti', 'prenositi', 'pružati', 'pružiti']","(0.0, 0.0)",positive,Neutralan
ENG30-03365991-n,prostorija ili skup prostorija koje obuhvataju jedan nivo višespratnice,"['sprat', 'nivo', 'etaž']","(0.0, 0.0)",positive,Neutralan
ENG30-02160779-v,"Svetleti sjajno, kao zvezda ili svetlo.","['svetleti', 'sijati']","(0.0, 0.0)",positive,Pozitivan
ENG30-07996598-n,kolonija zečeva,['jazbina'],"(0.0, 0.0)",negative,Negativan
ENG30-02222318-v,Baciti ili odbaciti.,"['odbaciti', 'odstraniti', 'zanemariti', 'rešiti se']","(0.0, 0.0)",negative,Negativan
ENG30-02679415-n,Sastojak koji se dodaje nečemu da ga poboljša.,['dodatak'],"(0.0, 0.0)",positive,Neutralan
ENG30-03839795-n,Predmet koji stoji na putu (i mora se ukloniti ili preći ili zaobići).,"['prepreka', 'zapreka']","(0.0, 0.0)",negative,Neutralan
ENG30-01220619-n,jaka kritika,"['atak', 'napad', 'napadaj', 'nasrtaj', 'navala']","(0.0, 0.0)",negative,Negativan
ENG30-02495922-a,Biti od koristi ili koji pruža uslugu.,['koristan'],"(0.0, 0.0)",positive,Neutralan
ENG30-04266660-n,Karta za igranje koja na licu ima simbol lista ili vrha koplja.,['pik'],"(0.0, 0.0)",negative,Neutralan
ENG30-02938886-n,Mala mašina koja se koristi za matematička izračunavanja.,['kalkulator'],"(0.0, 0.0)",positive,Neutralan
ENG30-00926932-v,pružiti duhovni uvid (u religiji),"['prosvetiti', 'prosvećivati']","(0.0, 0.0)",positive,Neutralan
ENG30-08293336-n,Grupa parnih brodova koji prevoze za istog vlasnika.,['flota'],"(0.0, 0.0)",positive,Neutralan
ENG30-09974648-n,Obučeni radnik koji obavlja neki zanat ili rukotvorinu.,"['obrtnik', 'zanatlija', 'majstor']","(0.0, 0.0)",positive,Neutralan
ENG30-07168131-n,Autoritativna uputa ili naređenje da se nešto uradi.,"['nalog', 'naredba', 'komanda']","(0.0, 0.0)",negative,Negativan
ENG30-10020890-n,Medicinski radnik sa dozvolom.,"['lekar', 'lečnik', 'doktor']","(0.0, 0.0)",positive,Neutralan
ENG30-05937112-n,reprezentativni oblik ili obrazac,"['model', 'primer']","(0.0, 0.0)",positive,Neutralan
ENG30-03049457-n,mala privatna prostorija za rad ili molitvu,"['kabinet', 'sobičak']","(0.0, 0.0)",positive,Neutralan
ENG30-01787955-v,"Naljutiti, posebno nevažnim uzrocima.","['dosaditi', 'dosađivati', 'nervirati', 'živcirati', 'gnjaviti', 'iritirati']","(0.0, 0.0)",negative,Negativan
ENG30-00901103-v,Učiniti da neko dođe da lično upozna.,"['predstaviti', 'upoznati']","(0.0, 0.0)",positive,Negativan
ENG30-08184861-n,Socijalno okupljanje gostiju ili drugara.,['društvo'],"(0.0, 0.0)",positive,Negativan
ENG30-07201804-n,Grafički ili živ verbalni opis.,"['slika', 'karakterizacija']","(0.0, 0.0)",negative,Neutralan
ENG30-00751944-n,čin namernog odstupanja od istine,"['izmišljotina', 'laž']","(0.0, 0.0)",negative,Negativan
ENG30-06634376-n,Primljena i shvaćena poruka koja smanjuje primaočevu nesigurnost.,['informacija'],"(0.0, 0.0)",positive,Neutralan
ENG30-10470779-n,Svešteno lice u hršćanskim crkvama koje ima odobrenje da obavlja različite raligijske obrede.,"['pop', 'sveštenik']","(0.0, 0.0)",positive,Neutralan
ENG30-00737399-n,devijantno ponašanje,"['aberacija', 'devijacija', 'devijantnost', 'nenormalnost', 'odstupanje']","(0.0, 0.0)",negative,Negativan
ENG30-01922303-n,bilo koja od brojnih relativno malih izduženih mekih životinja posebno redova Annelida i Chaetognatha i Nematoda i Nemertea i Platyhelminthes; takođe i mnoge larve insekata,['crv'],"(0.0, 0.0)",negative,Neutralan
ENG30-01214171-n,aktivna podrška; naročito čin zauzimanja i argumentovanja u korist koga ili čega,"['advokatura', 'odbrana', 'zauzimanje']","(0.0, 0.0)",positive,Neutralan
ENG30-13327231-n,Iznos za koji trošak poslovanja prelazi sopstveni prihod.,['gubitak'],"(0.0, 0.0)",negative,Negativan
ENG30-04834605-n,škrtost koja proizilazi iz brige za sopstvenu dobrobit i nepoštovanje drugih,['sebičnost'],"(0.0, 0.0)",negative,Negativan
ENG30-04159058-n,mustra koja se korsti za štampanje; koristi se da obezbedi zatvaranje ili autentičnost dokumenta,['pečat'],"(0.0, 0.0)",positive,Neutralan
ENG30-01301410-v,Onesposobiti kretanje nekom tako što se smesti unutar nekih granica.,"['zadržati', 'zatvoriti']","(0.0, 0.0)",negative,Neutralan
ENG30-01124246-n,mehanizam društvene kontrole za sprovođenje društvenih standarda,"['autoritet', 'dozvola', 'moć', 'odgovornost', 'ovlašćenje']","(0.0, 0.0)",positive,Neutralan
ENG30-08305942-n,Prijateljska država.,['saveznik'],"(0.0, 0.0)",positive,Neutralan
ENG30-01239064-n,Deljenje aktivnosti sa grupom.,"['učešće', 'uključenost']","(0.0, 0.0)",positive,Neutralan
ENG30-00855512-v,kritički procieniti,"['ceniti', 'ispitati', 'oceniti', 'pregledati', 'proceniti', 'procenjivati', 'prosuditi', 'prosuđivati']","(0.0, 0.0)",negative,Negativan
ENG30-07226545-n,Usmeni zalog jedne osobe drugoj kada se složi da će uraditi (ili neće uraditi) nešto u budućnosti.,['obećanje'],"(0.0, 0.0)",positive,Negativan
ENG30-02844056-n,(šahovska figura koja može da pomera dijagonalno po pljima iste boje,"['lovac', 'laufer']","(0.0, 0.0)",negative,Neutralan
ENG30-02854521-a,"o Bibliji, koji se tiče Biblije, koje je sadržan u Biblji, ili koji je u skladu sa Biblijom","['biblijski', 'skripturalan']","(0.0, 0.0)",positive,Neutralan
ENG30-10150556-n,član paravojne oružane snage koja se bori sa jačom silom putem sabotaže i uznemiravanja,"['gerilac', 'pobunjenik']","(0.0, 0.0)",negative,Negativan
ENG30-02235229-v,Odreći se vlasništva ili kontrole.,"['ustupiti', 'predati', 'prepustiti']","(0.0, 0.0)",negative,Negativan
ENG30-02250625-v,Isplatiti nadoknadu; odužiti se.,"['nadoknaditi', 'kompenzovati']","(0.0, 0.0)",positive,Negativan
ENG30-00138956-n,Čin hvatanja predmeta pomoću ruke.,"['grabljenje', 'ščepavanje', 'hvatanje']","(0.0, 0.0)",negative,Neutralan
ENG30-02505358-v,"prisiliti ili privoleti ili neprestano terati ili prisiljujući pritisak vršiti, ili snažno motivisati","['motivisati', 'naterati', 'podstaći', 'podstaknuti', 'podsticati', 'primorati', 'primoravati', 'prinuditi', 'privoleti', 'privoljavati']","(0.0, 0.0)",negative,Negativan
ENG30-01129532-n,odgajiti nekoga tako da bude prihvaćen kao član zajednice,"['gajenje', 'hraniteljstvo', 'negovanje', 'obrazovanje', 'odgajanje', 'odgoj', 'podizanje', 'uzgajanje', 'uzgoj', 'vaspitanje']","(0.0, 0.0)",positive,Negativan
ENG30-02225492-v,Sačuvati ili rezervisati za ličnu ili specijalnu upotrebu.,"['sačuvati', 'konzervirati']","(0.0, 0.0)",positive,Neutralan
ENG30-00059019-v,biti trudna sa,['nositi'],"(0.0, 0.0)",negative,Negativan
ENG30-03969627-n,Uzica o koju je obešen metalni teg koji pokazuje direktno na centar zemljine teže.,['visak'],"(0.0, 0.0)",positive,Neutralan
ENG30-00625393-a,"koji postoji u stvarnosti, uzet iz života","['stvaran', 'realan', 'materijalan']","(0.0, 0.0)",positive,Neutralan
ENG30-04306847-n,skulptura koja predstavlja ljude ili životinje,"['kip', 'skulptura', 'spomenik', 'statua']","(0.0, 0.0)",positive,Neutralan
ENG30-02626934-v,"izazvati promenu čega ili pretvoriti u nešto drugo, poprimiti nove karakteristike","['menjati', 'pretvarati', 'pretvoriti', 'promeniti', 'transformisati']","(0.0, 0.0)",positive,Neutralan
ENG30-03076708-n,Proizvodi s kojima se trguje.,['roba'],"(0.0, 0.0)",positive,Neutralan
ENG30-07240549-n,"Obraćanje publici u kome se nešto tumači, objašnjava.",['predavanje'],"(0.0, 0.0)",negative,Neutralan
ENG30-01627947-v,postepeno stvarati,"['formulirati', 'formulisati', 'razvijati', 'razviti']","(0.0, 0.0)",positive,Neutralan
ENG30-02210119-v,Uzeti nešto; doći u posed nečega.,"['dobiti', 'primiti']","(0.0, 0.0)",positive,Neutralan
ENG30-14011811-n,stanje mirne (ali moguće privremene) neaktivnosti,"['mir', 'neaktivnost', 'smirenost', 'spavanje']","(0.0, 0.0)",positive,Neutralan
ENG30-04895773-n,osobina neukazivanja poverenja drugima,"['nepoverenje', 'sumnja', 'sumnjičenje']","(0.0, 0.0)",negative,Neutralan
ENG30-05943066-n,Potpuno verovanje u osobu ili plan itd.,"['vera', 'poverenje']","(0.0, 0.0)",positive,Neutralan
ENG30-03176594-n,preparat koji se nanosi na kožu kako bi zaklonio neprijatne mirise,"['dezodorans', 'miris']","(0.0, 0.0)",negative,Negativan
ENG30-01885845-v,"Kretati se sporo; u slučaju ljudi ili životinja, sa telom blizu zemlje.",['puzati'],"(0.0, 0.0)",negative,Neutralan
ENG30-09184136-n,"Osobina ljudskog duha da prati sopstvenu delatnost i da je procenjuje sa vrednosne i moralne strane. Procesi su dati, spontano se odvijaju i podrazumevaju sposobnost uviđanja prirode svojih postupaka i namera. Ishodi saznajnih procesa praćeni su odgovarajućim afektivnim tonom, naročito primetni u slučajevima osećanja krivice i griže savesti.","['savest', 'skrupula', 'osećanje dužnosti']","(0.0, 0.0)",positive,Neutralan
ENG30-11452079-n,Sposobnost fizičkih sistema da rade; jedinice za energiju su džuli i ergi.,"['energija', 'snaga']","(0.0, 0.0)",positive,Neutralan
ENG30-07016648-n,ekstravagantan komad u kome je radnja više istaknuta nego karakterizacija,['melodrama'],"(0.0, 0.0)",negative,Neutralan
ENG30-00756331-n,čije pretvaranje da je druga osoba,"['gluma', 'glumatanje', 'imitacija', 'imitiranje', 'izigravanje', 'oponašanje', 'podražavanje', 'pretvaranje']","(0.0, 0.0)",negative,Negativan
ENG30-00202508-a,koji upućuje na sebe,"['povratan', 'refleksivan']","(0.0, 0.0)",positive,Negativan
ENG30-00607114-v,učiti čitanjem knjiga,"['čitati', 'iščitati', 'iščitavati', 'naučiti', 'pročitati', 'proučavati', 'učiti']","(0.0, 0.0)",negative,Neutralan
ENG30-04713118-n,kompatibilnost u mišljenju i djelovanju,"['harmonija', 'sklad', 'skladnost', 'usklađenost']","(0.0, 0.0)",positive,Neutralan
ENG30-09432430-n,Spoljašni omotač jajeta ptice.,"['ljuska', 'ljuska od jajeta', 'ljuska jajeta']","(0.0, 0.0)",negative,Neutralan
ENG30-01368863-v,ispružiti ili ispraviti; vratiti iz krivog položaja,"['istegnuti', 'istezati', 'protegnuti', 'protezati', 'pružati', 'pružiti']","(0.0, 0.0)",positive,Neutralan
ENG30-07906284-n,žestoko piće dobijeno fermentacijom žitarica,['viski'],"(0.0, 0.0)",negative,Negativan
ENG30-11443532-n,Tok elektriciteta kroz provodnik.,"['struja', 'električna struja']","(0.0, 0.0)",positive,Neutralan
ENG30-00181875-v,popuniti kakav prostor na neuredan način,['pretrpati'],"(0.0, 0.0)",negative,Negativan
ENG30-02469835-v,Delovati saglasno ili ujediniti u zajedničkom cilju ili verovanju.,"['sjediniti', 'ujediniti']","(0.0, 0.0)",positive,Neutralan
ENG30-02309165-v,fizički dati ili preneti,"['darivati', 'darovati', 'dati', 'davati', 'doneti', 'donositi', 'naneti', 'nanositi', 'poklanjati', 'pokloniti', 'predati', 'predavati', 'primeniti', 'primenjivati', 'pružati', 'pružiti', 'uručiti', 'uručivati', 'zadati', 'zadavati']","(0.0, 0.0)",negative,Neutralan
