ILI,definition,lemma_names,sentiment_SWN,sentiment_lexicon,sentiment_sa
ENG30-02531422-a,psihološki hladan i neentuzijastičan - neprijateljski nastrojen ili nezainteresovan ili takac koji pokazuje da koga ne voli,"['hladan', 'leden']","(0.0, 0.0)",positive,Negativan
ENG30-13937075-n,situacija koja se tretira kao osmotriv predmet,"['slika', 'scena']","(0.0, 0.0)",negative,Neutralan
ENG30-06399631-n,tekst koji je dodat u publikaciji; obično na njenom kraju,"['postscript', 'dodatak', 'prilog']","(0.0, 0.0)",positive,Neutralan
ENG30-01984669-a,sumnjivog ukusa ili morala,"['diskutabilan', 'sumnjiv']","(0.0, 0.0)",negative,Negativan
ENG30-04511002-n,"Objekat u kome je sedište visokog obrazovanja, uključujući upravu, smeštaj kao i prostorije za istraživanje i nastavu.",['univerzitet'],"(0.0, 0.0)",positive,Neutralan
ENG30-01173038-n,Snažan pokret pesnicom ili oružjem.,"['udarac', 'udar']","(0.0, 0.0)",negative,Negativan
ENG30-00858781-v,"podsticati ili ohrabrivati, naročito povicima","['bodriti', 'inspirisati', 'podsticati', 'dovikivati', 'podstrekivati', 'podstaći', 'navijati']","(0.0, 0.0)",positive,Negativan
ENG30-00719231-v,pozitivno na šta reagovati; ispravnim i pravilnim smatrati,"['podržati', 'podržavati', 'prihvatati', 'prihvatiti', 'primati', 'primiti']","(0.0, 0.0)",positive,Neutralan
ENG30-09777012-n,poslovni čovek koji kupuje ili prodaje za drugog u zamenu za proviziju.,"['posrednik', 'mešetar']","(0.0, 0.0)",positive,Neutralan
ENG30-03592245-n,kazneno-popravna ustanova koja se koristi za zadržavanje lica koja su pod zakonskim nadzorom vlade (bilo optuženi koji čekaju suđenje ili osuđene osobe na izdržavanju kazne),"['ćorka', 'tamnica', 'zatvor']","(0.0, 0.0)",negative,Neutralan
ENG30-08075388-n,Ljudi zaokupljeni naročitim zanimanjem.,"['bratstvo', 'fela']","(0.0, 0.0)",positive,Negativan
ENG30-12865824-n,"Žunasta biljka sa aromatičnim sivozelenim lišćem, koristi se za kuvanje.","['lekovita žalfija', 'kadulja', 'Salvia officinalis']","(0.0, 0.0)",positive,Neutralan
ENG30-00043195-n,Čin otkrivanja nečega.,['otkriće'],"(0.0, 0.0)",positive,Neutralan
ENG30-07367812-n,Neki događaj koji prekida.,"['prekid', 'upad']","(0.0, 0.0)",negative,Neutralan
ENG30-00207761-n,čin kojim se neka osoba proteruje iz domovine,"['progonstvo', 'izgnanstvo']","(0.0, 0.0)",negative,Negativan
ENG30-05823932-n,Osnova za verovanje ili neverovanje; znanje na kome se verovanje zasniva.,['razlog'],"(0.0, 0.0)",positive,Neutralan
ENG30-05667613-n,nešto što se smatra normativnim primerom,"['dogovor', 'forma', 'formula', 'konvencija', 'norma', 'pravilo', 'princip', 'propis', 'regulativa']","(0.0, 0.0)",positive,Neutralan
ENG30-00829378-n,Pažnja i uredovanje koje podrazumeva odgovornost za bezbednost.,"['briga', 'starateljstvo', 'zaštita']","(0.0, 0.0)",positive,Neutralan
ENG30-06731802-n,grupa simbola koji čine matematički iskaz,"['formula', 'izraz']","(0.0, 0.0)",positive,Neutralan
ENG30-12864545-n,Neka od raznovrsnih biljaka iz roda Salvia; rasprostranjena trava.,['žalfija'],"(0.0, 0.0)",positive,Neutralan
ENG30-01134861-n,Ponašanje sa nekim ili nečim.,"['tretman', 'postupak']","(0.0, 0.0)",positive,Neutralan
ENG30-04424418-n,Objekat koji nije posebno imenovan.,['stvar'],"(0.0, 0.0)",positive,Neutralan
ENG30-00452512-v,"Učiniti da nešto bude puno, može i u metaforičnom značenju.","['napuniti', 'ispuniti']","(0.0, 0.0)",positive,Neutralan
ENG30-06599788-n,Tematski sadržaj razgovora ili diskusije.,"['tema', 'tematika', 'predmet']","(0.0, 0.0)",negative,Neutralan
ENG30-00180413-n,čin prihvatanja i odobravanja; povoljan prijem,"['prihvatanje', 'tolerancija', 'usvajanje']","(0.0, 0.0)",positive,Neutralan
ENG30-03264136-n,oštra strana koju obrazuje presek dveju površina nekog predmeta,"['rub', 'ivica', 'ćošak']","(0.0, 0.0)",negative,Negativan
ENG30-02955065-n,Nešto što služi kao prekrivač ili zaštitnik.,"['kapak', 'pokrov']","(0.0, 0.0)",negative,Neutralan
ENG30-06328643-n,"gramatička kategorija u fleksivnim jezicima koja upravlja slaganjem između imenica, zamenica i prideva; u nekim jezicima je bazirana na prirodnom rodu ili kategoriji živo/neživo, dok je u drugima potpuno proizvoljna ili zasnovana na nekim drugim kriterijumima","['rod', 'gramatički rod']","(0.0, 0.0)",positive,Neutralan
ENG30-05207130-n,nemati snagu da se šta izvede,"['nemoć', 'nesposobnost', 'slabost']","(0.0, 0.0)",negative,Negativan
ENG30-00101956-v,isterati ili izbaciti (pljuvaču ili flegmu ili sputum) iz usta,"['ispljunuti', 'ispljuvati', 'pljuvati']","(0.0, 0.0)",negative,Negativan
ENG30-13764540-n,Količina koja može da stane u šaku.,['šaka'],"(0.0, 0.0)",negative,Neutralan
ENG30-03837422-n,oruđe pomoću koga se pokreće i usmerava čamac,['veslo'],"(0.0, 0.0)",positive,Neutralan
ENG30-14491271-n,"Stanje u kome je neko bogat, ima obilno materijalnih dobara i novca.",['bogatstvo'],"(0.0, 0.0)",positive,Negativan
ENG30-00198793-n,čin nazadovanja u pogledu čina i položaja,"['degradacija', 'raspoređivanje na lošije radno mesto']","(0.0, 0.0)",negative,Negativan
ENG30-01414626-v,"snažno udariti rukom, pesnicom ili nekim teškim instrumentom","['biti (1.l.sg. bijem)', 'izudarati', 'lupati', 'lupiti', 'tući', 'udarati', 'udariti']","(0.0, 0.0)",negative,Negativan
ENG30-01129977-a,moralno primeran,"['častan', 'dobar', 'primeran', 'ugledan']","(0.0, 0.0)",positive,Neutralan
ENG30-13837009-n,Poslovni odnos u kome se dve strane takmiče da pridobiju mušterije.,['konkurencija'],"(0.0, 0.0)",negative,Negativan
ENG30-01071411-n,popustljivost i saosećanje koje prema počiniocima kakvog krivičnog dela pokazuju lica ili agencije zadužene za sprovođenje pravde,"['blagost', 'milosrđe', 'milosrdnost', 'milost', 'milostivost', 'pomilovanje', 'samilost']","(0.0, 0.0)",positive,Neutralan
ENG30-02471327-v,Formalno se upisati; kao učesnik ili član.,"['upisati', 'priključiti', 'pridružiti', 'regrutovati']","(0.0, 0.0)",positive,Neutralan
ENG30-00549472-n,imitatorsko ponašanje,"['imitacija', 'imitiranje']","(0.0, 0.0)",negative,Negativan
ENG30-01619231-v,lišiti određenih karakteristika,"['poništavati', 'poništiti']","(0.0, 0.0)",negative,Negativan
ENG30-02906438-n,dekorativna značka koju nose žene,"['broš', 'kopča']","(0.0, 0.0)",negative,Neutralan
ENG30-02075296-n,Suvozemni ili vodeni sisar koji jede meso; suvozemni mesožderi imaju četiri ili pet prstiju sa kandžama na svakom udu.,"['zver', 'zvere', 'zverka']","(0.0, 0.0)",negative,Neutralan
ENG30-14361664-n,iznenadno grčenje mišića odnosno mišićnih vlakana.,"['grčevito trzanje', 'trzaj']","(0.0, 0.0)",negative,Negativan
ENG30-07522729-n,strah od nepoznatog ili od donošenja odluka,"['bojažljivost', 'plašljivost']","(0.0, 0.0)",negative,Negativan
ENG30-03497182-n,Precišćeni ekstrakt indijske konoplje; koristi se kao halucinogen.,['hašiš'],"(0.0, 0.0)",negative,Negativan
ENG30-01033189-v,šta objasniti ili tumačiti,"['interpretirati', 'komentarisati', 'napomenuti', 'objasniti', 'objašnjavati', 'pojasniti', 'pojašnjavati', 'prokomentarisati', 'protumačiti', 'tumačiti']","(0.0, 0.0)",positive,Neutralan
ENG30-00575741-n,Aktivanost koja je usmerena ka tome da se nešto uradi.,"['rad', 'posao']","(0.0, 0.0)",positive,Neutralan
ENG30-00807178-v,smatrati pogrešnim ili neprikladnim,"['ne odbriti', 'ne odobravati', 'odbaciti', 'odbacivati', 'odbijati', 'odbiti', 'zamerati', 'zameriti']","(0.0, 0.0)",negative,Negativan
ENG30-06170498-n,"izučavanje tehnika i pravila ya efikasno korišćenje jezika, posebno ya javne nastupe","['retorika', 'govorništvo']","(0.0, 0.0)",negative,Neutralan
ENG30-01015244-v,Obezbediti dokaze za nešto.,"['svedočiti', 'dokazati']","(0.0, 0.0)",positive,Negativan
ENG30-07456906-n,Period igre tokom koga je jedan tim u napadu (u sportovima).,"['inicijativa', 'napad', 'akcija']","(0.0, 0.0)",negative,Negativan
ENG30-00183090-b,(za naglašavanje značenja) izuzetno dobro,"['predivno', 'čudesno', 'sjajno', 'izvrsno', 'vrhunski', 'veličanstveno', 'izvanredno']","(0.0, 0.0)",positive,Pozitivan
ENG30-02673291-n,Jedna od četiri karte iz špila koje imaju jedan simbol na licu.,['as'],"(0.0, 0.0)",positive,Neutralan
ENG30-01202184-n,čin segregacije ili razdvajanja,"['aparthejd', 'odvajanje', 'razdvajanje', 'segregacija', 'separatizam']","(0.0, 0.0)",negative,Negativan
ENG30-06255777-n,Koristi se za pisanje ili štampanje.,"['list papira', 'list']","(0.0, 0.0)",positive,Neutralan
ENG30-14440875-n,stanje degeneracije mentalnih ili moralnih kvaliteta,"['degeneracija', 'dekadencija', 'izopačenje', 'korupcija', 'propadanje']","(0.0, 0.0)",negative,Negativan
ENG30-07130050-n,nešto što se govori,"['beseda', 'govor', 'obraćanje', 'predavanje', 'pričanje']","(0.0, 0.0)",positive,Neutralan
ENG30-07428954-n,Pojava koja nastaje naglim oslobađanjem energije zbog lomljenja i kretanja litosfernih stenskih blokova i koja uzrokuje širenje seizmičkih talasa kroz Zemljinu koru.,"['zemljotres', 'potres', 'trus']","(0.0, 0.0)",negative,Neutralan
ENG30-00638585-v,biti izračunat,"['izračunati', 'računati', 'sračunati', 'sračunavati']","(0.0, 0.0)",positive,Negativan
ENG30-02557199-v,sprečavati napredovanje ili postizanje nečega,"['opstruirati', 'blokirati', 'ometati']","(0.0, 0.0)",negative,Negativan
ENG30-00065855-n,priznanje od strane koledža ili univerziteta da je kakav kurs uspešno završen - obično meren brojem časova nastave,"['ESPB bod', 'kredit']","(0.0, 0.0)",positive,Neutralan
ENG30-02621395-v,Ciniti ili predstavljati nešto.,"['praviti', 'obrazovati', 'formirati']","(0.0, 0.0)",positive,Neutralan
ENG30-01150938-n,čin pristajanja (kao što je pristupanje čijim zahtevima),"['pristajanje', 'pristanak']","(0.0, 0.0)",positive,Negativan
ENG30-00099951-n,"prividni podvig, kakav naivni posmatrači smatraju za magičan","['iluzija', 'podvala', 'prevara', 'trik']","(0.0, 0.0)",negative,Negativan
ENG30-07592094-n,"komadi piletine ili drugog mesa dinstani sa npr. šargarepom, lukom i služe se sa rezancima ili knedlama",['paprikaš'],"(0.0, 0.0)",negative,Neutralan
ENG30-00403092-n,Čin oštećivanja nečega ili nekoga.,"['šteta', 'zlo', 'povreda']","(0.0, 0.0)",negative,Negativan
ENG30-01439190-v,Dokopati se nečega tako da se obustavi njegovo kretanje.,"['zgrabiti', 'ščepati']","(0.0, 0.0)",negative,Negativan
ENG30-05948264-n,sistem verovanja i rituala,"['kult', 'verski kult']","(0.0, 0.0)",negative,Neutralan
ENG30-05726596-n,Organizovana struktura za uređivanje i klasifikovanje.,"['sistem', 'organizacija', 'ustrojstvo']","(0.0, 0.0)",positive,Neutralan
ENG30-06405699-n,Slova upisana na nečemu (posebno izrezbarena ili ugravirana).,"['natpis', 'naslov']","(0.0, 0.0)",positive,Neutralan
ENG30-02447793-v,garantovati kako nešto ispunjava određeni standard,"['odobriti', 'potvrditi', 'potvrđivati', 'sertifikovati']","(0.0, 0.0)",positive,Negativan
ENG30-10480730-n,Neko ko je član nastavnog osoblja na fakultetu ili univerzitetu.,['profesor'],"(0.0, 0.0)",positive,Neutralan
ENG30-03699280-n,Kod starih Grka instrument sa žicama koje su davale određen ton; broj žica raznovrstan.,['lira'],"(0.0, 0.0)",positive,Neutralan
ENG30-07447641-n,Prilika o kojoj se ljudi okupljaju radi socijalnog druženja i zabave.,['prijem'],"(0.0, 0.0)",positive,Neutralan
ENG30-07921455-n,"fermentisano alkoholno piće koje se pravi od presovanog jabukovog soka ili kruške; termin koji se koristi u Evropi, posebno u Velikoj Britaniji","['jabukovača', 'sajder']","(0.0, 0.0)",positive,Neutralan
ENG30-02018372-v,stići gde na vreme,"['uhvatiti', 'uloviti']","(0.0, 0.0)",negative,Negativan
ENG30-08050678-n,Organizacija koja je upravljačko telo političke jedinice.,"['vlast', 'režim', 'vlada']","(0.0, 0.0)",positive,Neutralan
ENG30-04600486-n,jaka radna površina za stolara ili mehaničara,['klupa'],"(0.0, 0.0)",negative,Negativan
ENG30-01169317-n,Grupna akcija kao odgovor onima na vlasti.,['otpor'],"(0.0, 0.0)",negative,Neutralan
ENG30-00309310-v,Rasprsnuti se iznenada.,"['prsnuti', 'puknuti']","(0.0, 0.0)",negative,Negativan
ENG30-08111783-n,"Društvo u naprednom stadijumu razvoja (na primer, sa složenim zakonskim, političkim i religijskim organizacijama.",['civilizacija'],"(0.0, 0.0)",positive,Neutralan
ENG30-00755500-n,pretvaranje,"['gluma', 'glumatanje', 'izigravanje', 'pretvaranje']","(0.0, 0.0)",negative,Negativan
ENG30-07966140-n,Veća društvena grupa koja ima posebnu kulturnu i ekonomsku organizaciju.,"['zajednica', 'društvo']","(0.0, 0.0)",positive,Neutralan
ENG30-13652994-n,mera za dužinu,['lanac'],"(0.0, 0.0)",negative,Neutralan
ENG30-02853016-n,prostor u velikoj zgradi koji je podeljen u zasebne jedinice,['blok'],"(0.0, 0.0)",negative,Neutralan
ENG30-06319157-n,vrsta reči čija je glavna funkcija bliže određivanje vrste radnje izražene glagolom,['prilog'],"(0.0, 0.0)",positive,Neutralan
ENG30-02283716-v,na šta prava zadržati,"['čuvati', 'držati', 'održavati', 'sačuvati', 'zadržati']","(0.0, 0.0)",negative,Negativan
ENG30-07196682-n,rečenica koja traži odgovor,"['ispitivanje', 'pitanje', 'upit']","(0.0, 0.0)",positive,Neutralan
ENG30-03346455-n,otvoren ispust u zidu u podnožju dimnjaka gde se može paliti vatra,"['kamin', 'ognjište']","(0.0, 0.0)",positive,Negativan
ENG30-02557199-v,sprečavati napredovanje ili postizanje nečega,"['opstruirati', 'blokirati', 'ometati']","(0.0, 0.0)",negative,Negativan
ENG30-06773434-n,Pismeni sporazum između suverenih država.,"['pakt', 'sporazum', 'pogodba']","(0.0, 0.0)",positive,Neutralan
ENG30-02387034-v,pripremiti (nekoga) za buduću ulogu ili dužnost,"['dresirati', 'iškolovati', 'izdresirati', 'obrazovati', 'obučavati', 'obučiti', 'osposobiti', 'osposobljavati', 'podučavati', 'podučiti', 'pripremati', 'pripremiti', 'školovati', 'spremati', 'spremiti', 'trenirati', 'upraviti', 'upravljati', 'usmeravati', 'usmeriti', 'vaspitati', 'vaspitavati']","(0.0, 0.0)",positive,Neutralan
ENG30-02856286-a,o vrsti pesništva koje izražava emocije (često u vidu pesme) ili koji je povezan sa takvim pesništvom,['lirski'],"(0.0, 0.0)",positive,Neutralan
ENG30-08387213-n,najsnažniji članovi društva,"['aristokratija', 'plemstvo']","(0.0, 0.0)",positive,Negativan
ENG30-02806992-n,zgrada u kojoj se nalaze svlačionice za kupače,"['kupaonica', 'kupatilo']","(0.0, 0.0)",positive,Neutralan
ENG30-02343595-v,čega gubitak podneti,"['darivati', 'darovati', 'dati', 'davati', 'poklanjati', 'pokloniti', 'posvetiti', 'predati', 'predavati', 'prineti kao žrtvu', 'žrtvovati']","(0.0, 0.0)",positive,Negativan
ENG30-00888009-v,s najboljom namerom šta ponuditi,"['nuditi', 'ponuditi', 'pružati', 'pružiti']","(0.0, 0.0)",positive,Negativan
ENG30-00721437-v,napraviti kakvo otkriće,"['izneti na videlo', 'iznositi na videlo', 'izumeti', 'izumevati', 'naći', 'obznaniti', 'obznanjivati', 'opažati', 'opaziti', 'otkriti', 'otkrivati', 'pronaći', 'pronalaziti', 'uočiti', 'utvrditi', 'utvrđivati']","(0.0, 0.0)",positive,Negativan
ENG30-00325110-n,Čin penjanja na nešto.,"['penjanje', 'uspinjanje']","(0.0, 0.0)",negative,Negativan
ENG30-01313649-a,mesto na kome nema ljudi,"['usamljen', 'osaman', 'samotan']","(0.0, 0.0)",negative,Negativan
ENG30-01619014-v,"šta praviti ili dizajnirati, često na određeni način","['činiti', 'formirati', 'graditi', 'načiniti', 'napraviti', 'praviti', 'proizvesti', 'proizvoditi', 'sagraditi', 'stvoriti', 'tvoriti', 'učiniti']","(0.0, 0.0)",positive,Neutralan
ENG30-00404642-v,dovesti nešto u red,"['organizovati', 'organizirati']","(0.0, 0.0)",positive,Negativan
ENG30-02109818-v,patiti ili suočiti se sa bolom smrti,"['crkavati', 'crknuti', 'ginuti', 'izdahnuti', 'izdisati', 'poginuti', 'uginuti', 'umirati', 'umreti']","(0.0, 0.0)",negative,Negativan
ENG30-13858833-n,Nešto obrnuto po redosledu ili karakteru ili učinku.,"['obrnuto', 'suprotno']","(0.0, 0.0)",negative,Neutralan
ENG30-04159354-n,pričvršćivač koji pruža čvrsto i savršeno zatvaranje,"['pečat', 'pečatnik', 'plomba']","(0.0, 0.0)",positive,Neutralan
ENG30-00814850-v,"Opovrgnuti argumentima, dokazom ili činjenicama.",['odbaciti'],"(0.0, 0.0)",negative,Negativan
ENG30-14422488-n,stanje lošije od ranijeg stanja; postepeni pad iz boljeg stanja,"['opadanje', 'pad', 'pogoršanje', 'propadanje']","(0.0, 0.0)",negative,Negativan
ENG30-01139194-n,čin izdavanja formalnog (obično pisanog) ovlašćenja,"['dopuštenje', 'dozvola', 'licenca', 'odobrenje', 'zvanična pisana izjava koja vam daje pravo da uradite nešto v. dozvoliti']","(0.0, 0.0)",positive,Negativan
ENG30-00478830-v,"označiti za brisanje, obrisati ili izbrisati","['brisati', 'izbrisati', 'obrisati']","(0.0, 0.0)",negative,Neutralan
ENG30-03387016-n,Najniža podrška strukturi.,"['osnov', 'temelj', 'baza']","(0.0, 0.0)",positive,Negativan
ENG30-05669797-n,kakva praksa koja se tradicijom prenela iz prošlosti,"['baština', 'nasleđe', 'tradicija']","(0.0, 0.0)",positive,Neutralan
ENG30-02255268-v,dozvoliti kome da šta ima,"['dati', 'davati', 'deliti', 'dodeliti', 'dodeljivati', 'podeliti', 'prepustiti', 'raspodeliti', 'razdati']","(0.0, 0.0)",positive,Negativan
ENG30-07213395-n,Govorni čin koji jasno pokazuje nešto.,"['otkriće', 'otkrivanje']","(0.0, 0.0)",positive,Neutralan
ENG30-02737833-n,bilo kakav ekstremitet koji podseća na ruku,"['grana', 'grana (deo drveta)', 'grana drveta', 'grančica', 'noga', 'ogranak', 'pritoka', 'ruka', 'rukav', 'rukavac', 'ud']","(0.0, 0.0)",positive,Neutralan
ENG30-02207647-n,sterilni mrav ili termit bez krila koji ima veliku glavu i jake čeljusti prilagođene za odbranu kolonije,"['vojnik', 'ratnik']","(0.0, 0.0)",positive,Neutralan
ENG30-02484208-a,koji se kreće ili raste naviše,"['rastući', 'usponski']","(0.0, 0.0)",positive,Neutralan
ENG30-00757856-v,napustiti svoja uverenja ili veze,"['izdati', 'napustiti']","(0.0, 0.0)",negative,Negativan
ENG30-15212455-n,Mesec koji dolazi posle jula a pre septembra.,"['avgust', 'kolovoz']","(0.0, 0.0)",positive,Neutralan
ENG30-02385153-v,izgubiti kakavu poziciju ili moć ,"['gubiti', 'izgubiti', 'padati', 'pasti']","(0.0, 0.0)",negative,Negativan
ENG30-01127245-n,čin prisiljavanja silom ili autoritetom,"['nametanje', 'prinuda', 'prisila', 'prisiljavanje']","(0.0, 0.0)",negative,Negativan
ENG30-00865764-n,Rast mikroorganizama u pogodnoj sredini (biologija).,['kultura'],"(0.0, 0.0)",positive,Neutralan
ENG30-06582403-n,"zadati niz koraka, deo većeg računarskog programa","['funkcija', 'procedura', 'rutina', 'podprogram', 'podrutina']","(0.0, 0.0)",positive,Neutralan
ENG30-00486018-v,dovesti do zaključka ili dovesti do uspešnog razrešenja,"['ispuniti', 'izvesti', 'izvršiti', 'obaviti', 'ostvariti', 'sprovesti']","(0.0, 0.0)",positive,Neutralan
ENG30-05517578-n,male anatomske strukture u obliku kesice ii mehura koji sadrže tečnost.,"['vezikula', 'cista']","(0.0, 0.0)",negative,Negativan
ENG30-00262552-b,na prijateljski način,['prijateljski'],"(0.0, 0.0)",positive,Neutralan
ENG30-05058140-n,"Tempo, obično brz, kojim se nešto događa.","['brzina', 'hitrost']","(0.0, 0.0)",positive,Negativan
ENG30-07308889-n,primer nečega,['slučaj'],"(0.0, 0.0)",negative,Neutralan
SRP-475189302,Gljiva na drvetu; trud za kresanje.,"['guba', 'Polyporus fomentarius']","(0.0, 0.0)",negative,Neutralan
ENG30-01177327-n,"odbijanje da prihvati neki autoritet, kod ili konvencija","['buna', 'neposlušnost', 'pobuna', 'revolt', 'revolucija', 'ustanak']","(0.0, 0.0)",negative,Negativan
ENG30-07395623-n,kratka prodorna buka,"['škripa', 'pisak']","(0.0, 0.0)",negative,Negativan
ENG30-01906749-n,"Najniži tip višećelijskih životinja koje žive najčešće u moru, pojedinačno ili u kolonijama, pričvršćene na dno ili predmete.","['spužva', 'sunđer']","(0.0, 0.0)",negative,Neutralan
ENG30-02152991-n,životinja koja se lovi za hranu ili iz zabave,['divljač'],"(0.0, 0.0)",negative,Negativan
ENG30-09633969-n,Osoba koja krši morlne ili zakonske norme.,"['prekršitelj', 'krivac']","(0.0, 0.0)",negative,Negativan
ENG30-02541509-v,"Biti delegat ili zastupnik, predstavljati nečije interese ili biti zamena.","['predstavljati', 'reprezentovati']","(0.0, 0.0)",negative,Negativan
ENG30-00120784-a,biti ili imati nepoznat ili neimenovan izvor,"['neidentifikovan', 'neimenovan', 'neodređen', 'nepoznat', 'nespecifikovan', 'skriven']","(0.0, 0.0)",negative,Neutralan
ENG30-08387213-n,najsnažniji članovi društva,"['aristokratija', 'plemstvo']","(0.0, 0.0)",positive,Negativan
ENG30-02585050-v,pokušati uzavreti javno mnjenje,"['buditi', 'drmati', 'probuditi', 'prodrmati', 'protresti', 'razbuditi', 'razmrdati', 'tresti', 'uspaliti', 'zapaliti']","(0.0, 0.0)",negative,Negativan
ENG30-14012173-n,koji više nije aktivan; ugašen,"['gašenje', 'istrebljenje', 'izumiranje', 'uništenje']","(0.0, 0.0)",negative,Negativan
ENG30-10787470-n,Odrasla ženska osoba (nasuprot odrasloj muškoj osobi).,['žena'],"(0.0, 0.0)",positive,Neutralan
ENG30-04306847-n,skulptura koja predstavlja ljude ili životinje,"['kip', 'skulptura', 'spomenik', 'statua']","(0.0, 0.0)",positive,Neutralan
ENG30-10112129-n,Muški redovnik koji živi u manastiru i koji se posvetio molitvi i radu.,['monah'],"(0.0, 0.0)",positive,Neutralan
ENG30-01227908-n,čin pokazivanja poštovanja prema drugima,"['ljubaznost', 'pristojnost']","(0.0, 0.0)",positive,Neutralan
ENG30-01079480-v,"sa kakvim se protivnikom u sportu, igri ili bici nadmetati","['igrati', 'izazvati', 'ogledati se s kim', 'sastajati se', 'sastati se', 'sresti', 'sresti se', 'sretati']","(0.0, 0.0)",negative,Negativan
ENG30-01726879-v,kakav ritam opetovanim udarcima proizvoditi,"['bubnjati', 'dobovati', 'kucati', 'lupati', 'lupkati', 'tući', 'udarati']","(0.0, 0.0)",negative,Negativan
ENG30-01404702-a,"(o rukopisu, štampanom materijalu, itd.) koji je moguće pročitati","['čitak', 'čitljiv']","(0.0, 0.0)",positive,Neutralan
ENG30-03171356-n,struktura koja se koristi za odbranu,"['bedem', 'linija odbrane']","(0.0, 0.0)",positive,Neutralan
ENG30-02815950-n,"dug i debeo komad drveta, metala ili maltera itd, koji se koristi u građevinarstvu",['greda'],"(0.0, 0.0)",positive,Neutralan
ENG30-13952171-n,onaj ko se nalazi u podređenom položaju,"['lakej', 'podanik', 'posilni', 'potčinjeni', 'rob', 'robinja', 'sluga', 'sluškinja', 'služavka']","(0.0, 0.0)",negative,Neutralan
ENG30-12397210-n,Biljka jakog mirisa od čijeg se osušenog lišća pravi mnogo halucinantnih droga; sirovina za tkaninu i užad.,"['hašiš', 'marihuana', 'belojka', 'Cannabis sativa']","(0.0, 0.0)",negative,Neutralan
ENG30-00598954-v,"upoznati nešto ili postati nečega svestan, obično slučajno","['čuti', 'naći', 'naučiti', 'opaziti', 'otkriti', 'saznati', 'shvatiti', 'studirati', 'učiti', 'uočiti', 'utvrditi', 'videti']","(0.0, 0.0)",positive,Neutralan
ENG30-13524399-n,bilo koji proces koji čini da se zvuci ne izgovaraju pri izgovaranju reči ili izraza,"['brisanje', 'izostavljanje']","(0.0, 0.0)",negative,Neutralan
ENG30-05920159-n,Ideja koja se razmatra u dokumentu ili diskursu.,"['tema', 'suština']","(0.0, 0.0)",positive,Neutralan
ENG30-00334996-v,"Uništiti integritet nečega, obično silom; razdvojiti u deliće ili fragmente.","['polomiti', 'razlupati', 'razbiti', 'skrhati']","(0.0, 0.0)",negative,Negativan
ENG30-08649345-n,mesto unutar zone koje se identifikuje kao relativno u odnosu na centar,['strana'],"(0.0, 0.0)",negative,Neutralan
ENG30-00555648-n,Čin užurbanog kretanja na nepažljiv način.,"['žurba', 'hitnja', 'jurnjava']","(0.0, 0.0)",negative,Negativan
ENG30-08591269-n,država na čijem čelu se nalazi kralj,"['kraljevina', 'kraljevstvo']","(0.0, 0.0)",positive,Neutralan
ENG30-00099951-n,"prividni podvig, kakav naivni posmatrači smatraju za magičan","['iluzija', 'podvala', 'prevara', 'trik']","(0.0, 0.0)",negative,Negativan
ENG30-02779420-a,O kazni ili kažnjavanju.,['kazneni'],"(0.0, 0.0)",negative,Neutralan
ENG30-08272961-n,"Grupa ljudi, občno privremena koja ima zajednički cilj.",['savez'],"(0.0, 0.0)",positive,Neutralan
ENG30-00892861-n,podučavanje držanjem predavanja o nekom predmetu (obično pred odeljenjem učenika ili studenata),['predavanje'],"(0.0, 0.0)",negative,Neutralan
ENG30-01513430-v,Otresti se (nečega).,"['otresti', 'baciti', 'izbrisati']","(0.0, 0.0)",negative,Negativan
ENG30-09296121-n,deo mora ili okeana koji je većim delom okružen kopnom,['zaliv'],"(0.0, 0.0)",positive,Neutralan
ENG30-06325145-n,"funkcionalna reč koja se kombinuje sa imenicom, zamenicom ili imeničkom sintagmom dajući tako predloško-padežnu konstrukciju koja može imati pridevsku ili prilošku funkciju",['predlog'],"(0.0, 0.0)",positive,Neutralan
ENG30-00403249-b,Na značajan način.,"['značajno', 'važno']","(0.0, 0.0)",positive,Neutralan
SRP-129243479,Vrsta otrovne zmije.,"['poskok', 'grabarka', 'kamenjarka', 'crnokrug', 'Vipera ammodžtes']","(0.0, 0.0)",negative,Negativan
ENG30-00492706-v,Učiniti nečistim.,"['zaraziti', 'zagaditi']","(0.0, 0.0)",negative,Negativan
ENG30-00831903-a,"kome nedostaje znanje koje se stiče učenjem, često u određenom polju","['nenaučen', 'neobučen']","(0.0, 0.0)",negative,Neutralan
ENG30-07193184-n,traženje informacija,['ispitivanje'],"(0.0, 0.0)",negative,Neutralan
ENG30-00235110-v,nastaviti ili produžiti,"['produžiti', 'proširiti']","(0.0, 0.0)",positive,Neutralan
ENG30-08511777-n,Deo organa najbliži njegovoj tački ležišta (biologija).,['osnova'],"(0.0, 0.0)",negative,Neutralan
ENG30-00082308-v,smanjiti bol ili neprijatnosti ; ublažiti,"['olakšati', 'smiriti', 'tešiti', 'umiriti', 'utešiti']","(0.0, 0.0)",positive,Neutralan
ENG30-00750730-n,čiji pokušaj da te natera da uradiš nešto glupo ili neoprezno,"['pritisak', 'šega', 'trik']","(0.0, 0.0)",negative,Negativan
ENG30-02761897-v,učiniti da nešto prestane da gori ili svetli,"['ugasiti', 'utrnuti']","(0.0, 0.0)",negative,Negativan
ENG30-00007347-n,Neki objekat koji uzrokuje neka dešavanja.,"['agens', 'pokretač']","(0.0, 0.0)",positive,Neutralan
